{
  "$schema": "http://json-schema.org/draft-07/schema#",
  "$comment": "DEPRECATED MIRROR — canonical source is https://raw.githubusercontent.com/is-pinoy-dev/ecosystem/main/packages/schemas/schema/v1/subdomain.schema.json (generated from Zod in @is-pinoy-dev/schemas). This file is kept for back-compat with existing subdomain JSONs that reference it via $schema. New files should point at the ecosystem URL.",
  "type": "object",
  "properties": {
    "subdomain": {
      "type": "string",
      "minLength": 3,
      "maxLength": 63,
      "pattern": "^[a-z0-9-]+$"
    },
    "owner": {
      "type": "object",
      "properties": {
        "github": {
          "type": "string"
        },
        "id": {
          "type": "integer",
          "exclusiveMinimum": 0,
          "maximum": 9007199254740991
        },
        "email": {
          "type": "string",
          "format": "email",
          "pattern": "^(?!\\.)(?!.*\\.\\.)([A-Za-z0-9_'+\\-\\.]*)[A-Za-z0-9_+-]@([A-Za-z0-9][A-Za-z0-9\\-]*\\.)+[A-Za-z]{2,}$"
        }
      },
      "required": [
        "github"
      ],
      "additionalProperties": false
    },
    "records": {
      "type": "object",
      "properties": {
        "A": {
          "anyOf": [
            {
              "type": "object",
              "properties": {
                "ttl": {
                  "type": "number"
                },
                "value": {
                  "type": "string",
                  "format": "ipv4",
                  "pattern": "^(?:(?:25[0-5]|2[0-4][0-9]|1[0-9][0-9]|[1-9][0-9]|[0-9])\\.){3}(?:25[0-5]|2[0-4][0-9]|1[0-9][0-9]|[1-9][0-9]|[0-9])$"
                },
                "proxied": {
                  "type": "boolean"
                }
              },
              "required": [
                "value"
              ],
              "additionalProperties": false
            },
            {
              "type": "array",
              "items": {
                "type": "object",
                "properties": {
                  "ttl": {
                    "type": "number"
                  },
                  "value": {
                    "type": "string",
                    "format": "ipv4",
                    "pattern": "^(?:(?:25[0-5]|2[0-4][0-9]|1[0-9][0-9]|[1-9][0-9]|[0-9])\\.){3}(?:25[0-5]|2[0-4][0-9]|1[0-9][0-9]|[1-9][0-9]|[0-9])$"
                  },
                  "proxied": {
                    "type": "boolean"
                  }
                },
                "required": [
                  "value"
                ],
                "additionalProperties": false
              }
            }
          ]
        },
        "CNAME": {
          "anyOf": [
            {
              "type": "object",
              "properties": {
                "ttl": {
                  "type": "number"
                },
                "value": {
                  "type": "string",
                  "minLength": 1
                },
                "proxied": {
                  "type": "boolean"
                }
              },
              "required": [
                "value"
              ],
              "additionalProperties": false
            },
            {
              "type": "array",
              "items": {
                "type": "object",
                "properties": {
                  "ttl": {
                    "type": "number"
                  },
                  "value": {
                    "type": "string",
                    "minLength": 1
                  },
                  "proxied": {
                    "type": "boolean"
                  }
                },
                "required": [
                  "value"
                ],
                "additionalProperties": false
              }
            }
          ]
        },
        "TXT": {
          "anyOf": [
            {
              "type": "object",
              "properties": {
                "ttl": {
                  "type": "number"
                },
                "value": {
                  "type": "string",
                  "minLength": 1
                },
                "provider": {
                  "type": "string",
                  "enum": [
                    "vercel"
                  ]
                }
              },
              "required": [
                "value",
                "provider"
              ],
              "additionalProperties": false
            },
            {
              "type": "array",
              "items": {
                "type": "object",
                "properties": {
                  "ttl": {
                    "type": "number"
                  },
                  "value": {
                    "type": "string",
                    "minLength": 1
                  },
                  "provider": {
                    "type": "string",
                    "enum": [
                      "vercel"
                    ]
                  }
                },
                "required": [
                  "value",
                  "provider"
                ],
                "additionalProperties": false
              }
            }
          ]
        }
      },
      "additionalProperties": false
    },
    "features": {
      "type": "object",
      "properties": {
        "tools": {
          "type": "object",
          "properties": {
            "site-audit": {
              "type": "boolean"
            },
            "og": {
              "type": "boolean"
            }
          },
          "additionalProperties": false
        },
        "analytics": {
          "type": "boolean"
        }
      },
      "additionalProperties": false
    },
    "portfolio": {
      "type": "object",
      "properties": {
        "template": {
          "type": "string",
          "enum": [
            "terminal",
            "pixel-card",
            "minimal",
            "concrete",
            "broadsheet",
            "phosphor",
            "draft",
            "bubblegum",
            "grid",
            "bento",
            "noir",
            "solar"
          ]
        },
        "theme": {
          "type": "string",
          "enum": [
            "gold-dark",
            "mono",
            "matrix",
            "midnight",
            "crimson",
            "sunset"
          ]
        },
        "sections": {
          "type": "array",
          "items": {
            "type": "string"
          }
        }
      },
      "required": [
        "template"
      ],
      "additionalProperties": false
    },
    "destroy": {
      "type": "boolean"
    }
  },
  "required": [
    "subdomain",
    "owner",
    "records"
  ]
}
