{
  "$schema": "https://raw.githubusercontent.com/is-pinoy-dev/domains/main/schemas/v1/subdomain.schema.json",
  "subdomain": "jcchikikomori",
  "owner": {
    "github": "jcchikikomori"
  },
  "records": {
    "CNAME": {
      "value": "37d276efd4b22ece.vercel-dns-017.com."
    }
  },
  "features": {
    "tools": {
      "site-audit": true,
      "og": true
    }
  }
}
