{
  "$schema": "https://raw.githubusercontent.com/is-pinoy-dev/domains/main/schemas/v1/subdomain.schema.json",
  "subdomain": "jun",
  "owner": {
    "github": "bosquejun",
    "email": "bosque.junpaul@gmail.com"
  },
  "records": {
    "CNAME": {
      "value": "9d4debd2682df60d.vercel-dns-017.com.",
      "proxied": true
    },
    "TXT": {
      "value": "\"vc-domain-verify=jun.is-pinoy.dev,924ab466b2edf143cd12,dc\"",
      "provider": "vercel"
    }
  },
  "features": {
    "tools": {
      "site-audit": true
    }
  }
}
