{
  "$schema": "https://raw.githubusercontent.com/is-pinoy-dev/domains/main/schemas/v1/subdomain.schema.json",
  "subdomain": "jappe",
  "owner": {
    "github": "bosquejun"
  },
  "records": {
    "CNAME": {
      "value": "9d4debd2682df60d.vercel-dns-017.com.",
      "proxied": true
    }
  },
  "features": {
    "tools": {
      "site-audit": true,
      "og": true
    }
  }
}
